{
  "$schema": "https://json-schema.org/draft/2020-12/schema",
  "title": "TelemetryEvent",
  "type": "object",
  "additionalProperties": false,
  "required": [
    "schema_version",
    "event_id",
    "session_id",
    "car_id",
    "sequence",
    "source_time_s",
    "received_time_s",
    "channel",
    "value",
    "unit",
    "provenance",
    "quality"
  ],
  "properties": {
    "schema_version": {
      "const": "1.0"
    },
    "event_id": {
      "type": "string",
      "minLength": 1
    },
    "session_id": {
      "type": "string",
      "minLength": 1
    },
    "car_id": {
      "type": "string",
      "minLength": 1
    },
    "sequence": {
      "type": "integer",
      "minimum": 0
    },
    "source_time_s": {
      "type": "number",
      "minimum": 0
    },
    "received_time_s": {
      "type": "number",
      "minimum": 0
    },
    "channel": {
      "type": "string",
      "minLength": 1
    },
    "value": {
      "type": [
        "number",
        "null"
      ]
    },
    "unit": {
      "type": "string"
    },
    "provenance": {
      "enum": [
        "measured",
        "estimated",
        "configured",
        "simulated"
      ]
    },
    "quality": {
      "enum": [
        "valid",
        "degraded",
        "stale",
        "missing",
        "invalid"
      ]
    }
  }
}
